image,caption
112178718_87270d9b4d.jpg,a man in a white hat and blue shorts holds a black and white skateboard in his hand
103106960_e8a41d64f8.jpg,a boy in a red jacket is playing with a hockey stick
1311388430_4ab0cd1a1f.jpg,a person in a blue jacket is hanging on a wire in the middle of the mountains
128912885_8350d277a4.jpg,a white dog with a red ball in its mouth
1271210445_7f7ecf3791.jpg,a group of children sit around a birthday cake and look at the camera
1153704539_542f7aa3a5.jpg,the girls in the blue shirt is playing with a white drum and wearing a white helmet
111537222_07e56d5a30.jpg,a woman in a helmet is climbing down a rock wall.
1509786421_f03158adfc.jpg,a man and a young boy are playing a video game
109738763_90541ef30d.jpg,a man in an orange helmet is flying through the air
1424237335_b3be9920ba.jpg,two children girls in pink playing on a metal pole.
1042020065_fb3d3ba5ba.jpg,a boy in a green jersey is looking at a group of people in the water.
1034276567_49bb87c51c.jpg,a boy is eating a piece of bread
1104133405_c04a00707f.jpg,a boy in a white t - shirt is running in the grass
1262583859_653f1469a9.jpg,a man in a green vest rides a yellow bike and holds a drink in his mouth
1282392036_5a0328eb86.jpg,a woman in a red dress sits in front of a woman dressed in a red and blue costume and a man in a brown and blue costume
1472053993_bed67a3ba7.jpg,a person in a red jacket is skiing down a snowy hill.
103205630_682ca7285b.jpg,a brown dog sits in front of a blue tent in the snow
1245022983_fb329886dd.jpg,the little girl in the pink skirt is standing on the side of the road
1420060118_aed262d606.jpg,a man in a red jacket is jumping in the air
1263801010_5c74bf1715.jpg,a man in a red jacket is walking in the snow
143552829_72b6ba49d4.jpg,a man in a red jacket is riding a dirt bike in a muddy area.
1312954382_cf6d70d63a.jpg,a little girl in a green dress is holding on to a balloon in the middle of the street
1009434119_febe49276a.jpg,a black and white dog running in the grass
1184967930_9e29ce380d.jpg,a brown dog in a field with purple flowers
1517340899_ee1c74a8f6.jpg,a little girl in a pink shirt is jumping in the air
1363843090_9425d93064.jpg,a black dog is walking through a shallow water area.
1505686764_9e3bcd854a.jpg,a man in red shorts is standing in front of a small brook in the woods.
1177994172_10d143cb8d.jpg,two children play in the rain
1260816604_570fc35836.jpg,a woman sits in a red car in a parking lot.
1358892595_7a37c45788.jpg,a golden dog running in a field with a ball in its mouth
152029243_b3582c36fa.jpg,a man in a helmet is riding a dirt bike in a rocky area
1100214449_d10861e633.jpg,a boy in a red and blue striped shirt is jumping into a fountain.
1397923690_d3bf1f799e.jpg,a man with a backpack and ski poles in the snow
1107471216_4336c9b328.jpg,a girl with blonde hair holds a gun and looks at the camera
138705546_be7a6845dd.jpg,two girls sit on a rock wall near the water.
136644343_0e2b423829.jpg,a boy in a blue t - shirt is swinging on a swing in the park.
1303727066_23d0f6ed43.jpg,a man in a green peace sign t - shirt
1056873310_49c665eb22.jpg,a brown dog is running on a rocky beach near the water.
1443807993_aebfb2784a.jpg,a little girl in a white bikini suit is sliding down a green and red inflatable obstacle.
1132772170_600610c5df.jpg,a man in blue shorts is jumping in a hotel room
1397295388_8a5b6b525d.jpg,a crowd of people in a busy airport
1094462889_f9966dafa6.jpg,a golden dog in the snow
1332492622_8c66992b62.jpg,a pink and blue painted building with a metal balcony and a metal fence
1387461595_2fe6925f73.jpg,two men are standing in front of a sign that says peace
123889082_d3751e0350.jpg,two dogs running in the grass
108899015_bf36131a57.jpg,a person in a red jacket is skiing down a snowy hill.
1057210460_09c6f4c6c1.jpg,a woman in a blue shirt is standing in front of a glass door
127490019_7c5c08cb11.jpg,a woman in a blue shirt and white shorts is playing in the grass.
1329832826_432538d331.jpg,"a man in a black jacket is standing in front of a red and blue sign that says, donut"
1095476286_87d4f8664e.jpg,a boy in a yellow shirt is playing in a fountain.
1511807116_41c3645e8c.jpg,a dog is playing with a dog toy in its mouth
111537217_082a4ba060.jpg,a man in a white t - shirt is rock climbing
1490213660_9ea45550cf.jpg,a beige dog is walking through a small river.
1500853305_0150615ce9.jpg,a little girl in a red and blue shirt is standing on a wooden bridge in the woods.
143688205_630813a466.jpg,a person in a blue helmet is climbing up a large rock.
1388373425_3c72b56639.jpg,a woman in a black shirt is sitting on a brick wall and talking on
1189977786_4f5aaed773.jpg,a brown dog leaps into the pool to get into the water.
1392272228_cf104086e6.jpg,a black dog with a stick in its mouth running through the water.
1383840121_c092110917.jpg,a brown dog with its tongue hanging out and its tongue hanging out
125319704_49ead3463c.jpg,a man and a woman on a mountain bike in the woods
1304961697_76b86b0c18.jpg,two children in blue shorts waterkiing in the water
1089755335_0bfbfd30e6.jpg,a group of people fishing on a pier at night
1211015912_9f3ee3a995.jpg,a little girl in a yellow dress is playing with a red ball in the middle of the picture
1523800748_a59e980eee.jpg,two children running on the beach near the water.
1191338263_a4fa073154.jpg,a woman sits on a bench in front of a large screen with a picture of a man in the background
1280147517_98767ca3b3.jpg,a man is pulled behind a boat as he rides through the water
1236964638_1808784a3c.jpg,a man in a green and blue shorts is jumping into the pool.
1148238960_f8cacec2fc.jpg,a group of people riding bikes on a city street.
1466479163_439db855af.jpg,a dog running in a field with a ball in its mouth
1446053356_a924b4893f.jpg,two girls in black and white playing with a soccer ball
1351315701_6580b51c41.jpg,a black and white dog running in a field
148512773_bae6901fd6.jpg,two people are sitting on a cliff overlooking over the water.
1313693129_71d0b21c63.jpg,two children stand on the shore of a lake.
1119463452_69d4eecd08.jpg,a little girl in a pink life jacket is in the water
136552115_6dc3e7231c.jpg,a man in a helmet is doing a trick in the air
1472249944_d887c3aeda.jpg,a woman in a red jacket and a woman in a brown jacket are sitting on a stone wall in a park.
1423997242_ea2189ec5e.jpg,a man in a grey cap sits in a field
1400424834_1c76e700c4.jpg,a woman in a black and white striped shirt is standing on the side of the street
1402843760_d30f1dbf0f.jpg,a small white dog is running in the grass
1032122270_ea6f0beedb.jpg,a woman and three dogs in a field
1124448967_2221af8dc5.jpg,a man is sitting on a bench in front of a blue bike and a blue and green awning awning
1417637704_572b4d6557.jpg,two young girls in blue jackets are sitting in the open door of a vehicle.
1022454332_6af2c1449a.jpg,a boy in a black shirt is standing on the shore of a lake with a small body of water and a city in the background
1413956047_c826f90c8b.jpg,three people standing on top of a mountain
118187095_d422383c81.jpg,a woman in a red and blue helmet rides a red and blue car with a blue and blue rope and a red and blue rope on the
1248357227_2b4175fc39.jpg,a man and a woman in a white hat are fishing in the water
1144288288_e5c9558b6a.jpg,a woman in a white hat and blue shorts is walking down the street.
1042590306_95dea0916c.jpg,a man and woman sitting on a park bench eating
1117972841_2b9261f95f.jpg,a brown dog is playing in the sand.
1439046601_cf110a75a7.jpg,a boy in a red and blue shorts is standing in a swimming pool.
1454841725_4b6e6199e2.jpg,the girls are all smiling and posing for the camera
1319634306_816f21677f.jpg,a brown dog sits in a field and looks at the camera
1430154945_71bbaa094a.jpg,a woman and a baby boy sit at a table eating
1488937076_5baa73fc2a.jpg,three dogs running in a row
1460500597_866fa0c6f3.jpg,a man sits at a table in a restaurant
1457762320_7fe121b285.jpg,three people stand near a group of three - wheeled bikes
1355833561_9c43073eda.jpg,a man in a red jacket holds a child in the air on the beach
1295671216_cde1b9c9d1.jpg,a group of people stand in a line and eat
1244485675_822e6efe60.jpg,a boy in a red vest is looking at a picture of a boy in a red vest
1433088025_bce2cb69f8.jpg,a man in yellow shorts and a man in a blue shirt
1439282131_3814d6ae04.jpg,two golden dogs play in the water.
135235570_5698072cd4.jpg,a man in a blue jacket is playing with a blue ball in front of a large stone building.
1277185009_06478dd457.jpg,a man in a white shorts is standing on top of a mountain.
1470061031_4cb59c12a8.jpg,three dogs play on a brick paved walkway.
1143373711_2e90b7b799.jpg,a man in a blue helmet rides a bike down a city street.
1478294229_7e1c822fea.jpg,the legs of a man wearing a pair of brown shoes is on a bike and a man in a grey shorts and a brown and blue striped
1131932671_c8d17751b3.jpg,a baby boy in a blue bow is jumping on a green bed
1394396709_65040d97ab.jpg,a golden dog with a toy in its mouth in the water
1316247213_1d2c726dd5.jpg,a smiling girl in a purple hat is standing in the grass
1306145560_1e37081b91.jpg,a black dog with a ball in its mouth in the water
1142847777_2a0c1c2551.jpg,a man in a helmet rides a blue bike on a city street.
1394599090_fe0ba238f0.jpg,a man and a little boy in a white shirt play in a swimming pool.
1332208215_fa824f6659.jpg,a man and a woman are sitting on a train
1259936608_e3f0064f23.jpg,children playing in a public fountain.
150582765_bad8dec237.jpg,a woman in a pink sweater is taking a picture with a camera
133189853_811de6ab2a.jpg,two men dressed in black and white are posing for the camera
1247181182_35cabd76f3.jpg,a woman in a purple backpack is sitting on top of a rocky cliff.
1229756013_94663527d7.jpg,a brown dog leaps into the air to catch a toy in its mouth
146577645_91b570c0d0.jpg,a man in a red helmet is kayaking in rough water.
108898978_7713be88fc.jpg,a man in a yellow jacket and a woman in a blue helmet in the snow
1298295313_db1f4c6522.jpg,a boy in a blue life jacket is jumping into the water.
1290894194_8a4ffdc7eb.jpg,a woman in a red and white striped dress plays with a small dog in a red and white striped outfit
1478268555_7e301fc510.jpg,a man in shorts is rock climbing
1396703063_e8c3687afe.jpg,a man in a straw hat and a woman in a white t - shirt
1030985833_b0902ea560.jpg,a brown dog and a brown dog with a red collar
1427391496_ea512cbe7f.jpg,a little boy in a blue sweater is standing on a wooden dock near the water.
107582366_d86f2d3347.jpg,a group of people sit at a table in the dark
1093716555_801aacef79.jpg,a group of hikers in the mountains
1348891916_ebd4413033.jpg,a brown dog running through the water.
1475046848_831245fc64.jpg,a woman in a blue shorts is walking on the beach
140526327_3cb984de09.jpg,a man in a red helmet is climbing up a cliff near the water.
1501297480_8db52c15b0.jpg,two young boys play in a house with a metal fence and a metal fence behind them
1253275679_e955fb7304.jpg,a boy in a black t - shirt with white letters on it
1334892555_1beff092c3.jpg,three children playing with a baseball bat
1516714577_7d1c35a8d8.jpg,a little girl in a red skirt and a white t - shirt is standing in front of a brick wall.
123997871_6a9ca987b1.jpg,the girls in the blue and red uniform is playing with the ball
1237985362_dbafc59280.jpg,a young girl in a blue dress holds on to a little girl in a blue dress and a little boy in a blue and white headband
1428578577_82864facae.jpg,a person in a black jacket is standing on top of a snowy mountain
12830823_87d2654e31.jpg,a group of people in a green room
1482960952_95f2d419cb.jpg,three women wearing a green coat and a grey skirt are walking in a parking lot.
113678030_87a6a6e42e.jpg,three people are sitting in the snow
1312227131_771b5ed201.jpg,a dog running in the snow with the sun in the background
1007320043_627395c3d8.jpg,a little girl in a pink and orange shirt is playing on a red rope fence.
1428681303_04213524e3.jpg,three children play near a statue in a city
1387443857_602ab6f9bf.jpg,a man in a blue shirt is sitting on a dock with several people nearby
1075881101_d55c46bece.jpg,a woman in a white shirt is covered in snow as a man looks on
1363924449_487f0733df.jpg,a little boy in a striped shirt and blue shorts is holding his head to his head
1305564994_00513f9a5b.jpg,a man in a helmet and helmet rides a white and blue racing vehicle
1394927474_0afdd82fc4.jpg,a man with a green umbrella stands in front of a large wooden door.
1143882946_1898d2eeb9.jpg,a woman wearing a helmet and a blue backpack rides a bike in the street
