image,blip_caption,reference_captions
3341477531_4e37450f35.jpg,a man on a skateboard,"['A shirtless man is doing a skateboard trick .', 'A shirtless man rides a skateboard .', 'A shirtless man skateboarding with his arms in the air .', 'A shirtless man skateboards on a ledge .', 'The skateboarder enjoys night skating at the skate park .']"
3326454455_960e5442e9.jpg,two men playing soccer,"['A male soccer player wearing a red uniform jumping in the air and pulling up his shorts .', 'A soccer player pulls his shorts up .', 'A soccer player wearing a red costume makes an obscene gesture .', 'Man in red sports uniform and blue shoes jumping and pull up legs of shorts .', 'We can see the white underwear of the man wearing the red soccer jersey because he is pulling up his shorts .']"
430964917_022995afb6.jpg,a person riding a bike down a street,"['A bicyclist with a backpack rides down a suburban street .', 'A man riding a bike wearing flannel shirt , plaid pants and a blue backpack while riding on a street near buildings and parked cars .', 'A man wearing lots of plaid riding a bike through the streets', 'A person wearing a blue and white coat rides a bicycle down the street .', 'Person riding their bicycle on the street with a backpack on .']"
3741827382_71e93298d0.jpg,a boy on a water slide,"['A boy in a green shirt above something blue .', 'a small boy getting tossed into the air', 'A young boy jumps around on a blue mat with a half-smile on his face .', 'A young boy plays in front of a blue object .', 'The boy wearing the green shirt is climbing on a blue inflatable .']"
2799871904_3b3125518a.jpg,a woman sitting on a bench,"['A gray haired woman in a yellow shirt sitting under a blue sign .', 'An older woman sits under a sign advertising a 3 slice special .', 'A woman facing down is sitting under an advertisment .', 'A woman sits underneath a sale sign .', 'A woman wearing a yellow shirt sits on a wooden bench .']"
3255737244_1f8948fc07.jpg,two little girls hugging,"['A girl and boy hugging in the cobblestone street .', 'A little boy kisses a little girl on the side of the road .', 'A little boy tells a secret to a little girl', 'The two children stand on a cobblestone street and play .', 'Two young children playing on the street .']"
2341254813_c53a5ef27a.jpg,a young boy in a green shirt is on a skateboard,"['a boy in a green shirt is jumping with his arms in the air at the end of a bowling alley .', 'A boy wearing a green shirt is jumping in front of a lane at a bowling alley .', 'A child jumps in the air at a bowling alley .', 'A young boy with a Mohawk and green shirt is excited about bowling .', 'A young boy with a Mohawk jumping at a bowling alley']"
3463523977_f2ed231585.jpg,a little girl standing next to a white swan,"['A girl in a pink shirt jumps and stars at a swan in the park .', 'A red-haired girl is jumping by a swan .', 'A red haired girl is jumping towards a swan .', 'A young girl with red hair is playing on a sidewalk with a swan .', 'a young red haired girl jumping on the sidewalk next to a white duck .']"
1521623639_4bda3407cc.jpg,a man sitting on a bench under a tree,"['A homeless man sitting on a sofa under an overpass .', 'A man is sitting on a couch under an expressway ledge .', 'A man sits on a couch outside under an overpass .', 'Bum sitting on a couch next to a bridge .', 'The man sits on a sofa under the bridge and litter is all around him .']"
1389323170_d1c81d6b51.jpg,a woman sitting on an inflatable on a sidewalk,"['a lone woman sitting on an usual green bench with a cup in her hand', 'A woman sits on a flower pot at a crowded coffee shop .', 'The woman sat on a green bench and had a drink .', 'Woman holding a drink with a white bag next to her is sitting on a green sculpture .', 'Woman sitting on a turquoise bench with a pillow and a bag near a restaurant .']"
339822505_be3ccbb71f.jpg,a man wearing a costume,"['A man is placing jewelry on an extravagantly-haired and decorated female sculpture or stiffly-posed woman .', 'A performer wearing a h', 'A person being dressed in clothing with feathers and sequins .', 'The dancer gets her final makeup before going out onstage .', ""Two men fixing drag queen 's costume .""]"
2431470169_0eeba7d602.jpg,a man sitting at a table outside eating food,"['A man sitting at an outside table , eating lunch , marking on a paper .', 'a single man sitting at a round table reading outside of a shop', 'Man reading a newspaper at an outdoors restaurant .', 'Man reading in a chair outside', 'The man is taking notes at the table .']"
3574627719_790325430e.jpg,a group of young men,"['a group of young men sing out together .', 'Three guys , with a guitar , yelling .', 'Three young men embrace and sing .', 'Three young men sing together while one plays the guitar .', 'Young people celebrate in song .']"
2597308074_acacc12e1b.jpg,the sky is cloudy,"['A boy and a girl at the beach , throwing sand .', 'a boy flings sand at a girl .', 'A boy with an orange tool on the shore is spraying a girl standing in shallow water with mud .', 'Boy flings mud at girl', 'The young boy flings mud at the barefoot girl in the pond .']"
979383193_0a542a059d.jpg,a group of children sitting at a table,"['A group of six children sit at a wooden table .', 'A group of young asian children pose for a picture at a table .', 'Six children , all with black hair , sit at a table for a picture .', 'Six children at a table .', 'Six small children sitting at a desk .']"
166654939_80ea4ddbcc.jpg,dirt on the track,"['A group of race buggies travel down a racetrack .', 'Cars racing on a dirt track', 'Race cars are racing each other on a dirt racetrack and the green one is in the lead .', 'Ralley cars muscle for position on a dirt track .', 'Two lines of colorful cars racing on a racetrack .']"
3723903586_e98d3d8ec7.jpg,the greyhounds are racing,"['greyhounds racing on a track', 'A greyhound race with the lead dog wearing yellow and black stripes and the number 8', 'Dogs racing at a track .', 'Greyhound dogs race on the track , with # 8 leading the way .', 'Some greyhound dogs are racing on a dirt track .']"
2446315531_7c9704eec0.jpg,two dogs playing in the dirt,"['Two brown dog grapple each other in a sandy area .', 'Two brown dogs are biting each other .', 'Two brown dogs are wrestling with each other on some wasteland .', 'Two brown dogs biting each other on sand .', 'Two tan colored dogs playing .']"
384465370_9918873f9a.jpg,a man riding a bike down a dirt road,"['Two cyclists atop a hill as seen from below .', 'two cyclist wearing red shirts going over a red hill', 'Two people in red outfits riding their bicycles down a dirt road .', 'Two people ride their bikes down a dirt road .', 'Two people riding their bikes on a hill .']"
1999444757_1b92efb590.jpg,a group of people playing a game in a gym,"['A girl in white is swinging a sword .', 'A lady shows her sword', 'A woman is swordfighting with an unseen opponent .', 'Boy in martial arts-style uniform holding a sword .', 'Two women watching people in white shirts , one of those persons holding a sword .']"
2854291706_d4c31dbf56.jpg,a man and a woman walking down the street,"['A man and a woman are wearing black and looking at something on the sidewalk .', 'A man and a woman standing in front of signs .', 'a man and women looking at magazines in a window .', 'A man puts his arm around a woman as they look at signs on the street .', 'Interracial couple stand together looking at a display on street']"
2562463210_d0dfd545ca.jpg,a boy in a pool,"['A boy in a pool wearing Spiderman floaties .', 'a boy with spiderman armbands is in the swimming pool by the wall at the edge .', 'A boy with spiderman swimming is in a pool .', 'A young boy wearing Spider-Man water-wings at the edge of the pool .', 'The boy is in the swimming pool .']"
3019857541_3de3e24f54.jpg,a dog standing on top of a pile of leaves,"['A brown dog leaps in the air over colorful leafs', 'A dog is jumping in the air over some leaves .', 'A dog is running through a backyard full of leaves .', 'A dog knocking over potted plants in a yard covered in leaves .', 'The small brown dog is amidst the potted plants and fallen leaves .']"
3351418768_596ef7fd6f.jpg,a woman and two children,"['a family standing in a rock cave with some of their belongings in the background', 'An Afican American woman standing behind two small African American children .', 'An African woman stands with her two children under a boulder .', 'A woman and two children pose for a picture under some rocks .', 'A woman in purple with two children in the mouth of a cave .']"
367964525_b1528ac6e4.jpg,a dog in the snow,"['A brown and white dog running out of the woods through snow .', 'A dog jumps and runs through the forest and snow-covered ground .', 'A dog running through snow with trees in the background', 'A German shepherd playing in the snow near the woods .', 'A large German shepherd runs though deep snow .']"
2813033949_e19fa08805.jpg,a dog jumping in the air,"['A black and white dog jumping for a ball .', 'A black and white dog jumps for a tennis ball .', 'A white and black dog is jumping in the air trying to catch a tennis ball .', 'A white and black dog is playing with a tennis ball near flowers .', 'There is a white and black dog jumping off the ground trying to catch a ball .']"
2256133102_e2c8314ecb.jpg,the water is blue,"['A man in blue pants repels off a cliff over water .', 'A man is hanging by a line off a cliff above water .', 'An individual rappelling down a cliff towards the water', 'A person hangs from a rope on a cliff', 'Someone dangles on a rope from a rocky cliff over the ocean .']"
2831217847_555b2f95ca.jpg,a car driving through a stream in a forest,"['A blue jeep sits in the middle of a stream running through a forested area .', 'A blue Land Rover is driving across a river .', 'A blue SUV drives in a stream surrounded by woodlands .', 'A blue SUV driving over a small creek .', 'The vehicle is crossing a stream of water , in a wooded area .']"
278002800_3817135105.jpg,a man eating a piece of pizza,"['A guy in black jacket eating .', 'A man eats a pastry .', 'A man in a black coat eats a doughnut while other men look out of frame .', 'A man in a black jacket is eating a pastry while standing next to two other men .', 'A man in black is eating a baked good near two elderly men .']"
2396746868_0727e06983.jpg,a boy on a slide,"['A boy going down a small blue slide .', 'a kid sliding down a slide while another kid looks on', 'A little boy is going down a blue slide .', 'A little boy is watching another little boy ride on a blue slide .', 'Two little blonde boys play on a slide in the backyard .']"
341430859_4519802e8f.jpg,a dog that is standing in the snow,"['A brown and white dog stands in the deep snow .', 'A dog in the snow .', 'A dog stands in deep snow surrounded by trees .', 'A dog stands up to his elbows in snow .', 'Dog sits in snow .']"
2534502836_7a75305655.jpg,a dog running through a field of tall grass,"['A medium sized brown and white streaked dog is running through tall grass .', 'A single tan-and-white dog dashes through tall green grass .', 'A small brown and white dog running through tall grass .', 'A small dog runs through a grassy field .', 'A white and tan dog runs through the tall green grass .']"
3459419203_cd7c68ce4d.jpg,a woman swimming in a pool at night,"['A girl is being splashed by water in a pool .', 'A girl wearing blue water googles is being splashed in the face with water by a fellow swimmer .', 'A woman swimmer in a pool gets splashed by her teammate swimming past .', 'The woman is in a pool and being splashed', 'Two people are in a swimming pool with water splashing around .']"
537359971_6e28f5e66e.jpg,two women walking down the street,"['two woman wearing skirts walking down the street together', 'Two women in skirts walking across a street .', 'Two women ion skirts walk across a parking lot .', 'Two women , wearing skirts and carrying purses , cross street in urban area .', 'Two women with purses walk in an urban location .']"
3430782104_34da558eba.jpg,a man riding a horse,"['A cowboy on a horse ropes a steer .', 'A cowboy trying to rope a bull while on a horse', 'A cowboy wrangles a calf in a rodeo .', 'a girl on a horse trying to catch a bull with a rope', 'A person attempts to rope a black cow while riding a horse .']"
3371533654_73a12a35a4.jpg,a man riding a skateboard down a metal tube,"['A man is skating through a tunnel .', 'A person skates along the inside of a long tube .', 'A rollerblader rides high in a full pipe while others watch', 'A rollerblader skating inside a tube .', 'A skateboarder whizzes through a tunnel .']"
1540631615_8b42c1b160.jpg,yellow lines on the field,"['A boy in a red jacket does a gymnastic maneuver on a grassy athletic field .', 'A child in a red jacket doing a handstand on green grass .', 'A little boy in red doing a handstand .', 'Boy wearing a red jacket performs a handstand on the grass .', 'Young boy in red jacket doing a handstand on a sports field .']"
3309042087_ee96d94b8a.jpg,snow on the ground,"['a lone snowboarder jumping on the side of a snowy mountain .', 'A scene of snow and water .', 'A snowboarder jumping in the air off of snow .', 'A snowboarder is making a jump over a hillside with deep powder located in the woods .', 'A snowboarder jumps high over the snowy hill .']"
3350785999_462f333c44.jpg,a group of people,"['A crowd of women and children looking at the photographer .', 'A group of African women and children wearing brightly colored clothes .', 'A group of colorfully clothed people are sitting in a market .', 'Numerous African Americans wearing various types of clothing .', 'People from an African village are sitting on the ground .']"
2275253272_00f941366e.jpg,a little girl walking down a path,"['a girl in a green dress and pink jacket is running down a dusty path in a grassy park .', 'A girl wearing a pink sweater and green dress in walking down a path .', 'A little girl holding flowers is walking away down a path on a sunny day .', 'A little girl is walking along a path .', 'A little girl walking down the sidewalk .']"
3182570190_48214e54c7.jpg,a black and white photo,"[""A giant billboard of a man 's abs"", 'Pedestrians walk in front of an advertisement depicting a shirtless man in jeans .', 'people pass by a huge black and white poster of a male model unzipping his jeans .', 'People walk by a large advertisement of partially naked man .', 'Some people walk past a large billboard .']"
350443876_c9769f5734.jpg,the curtains are blue,"['A little baby climbing up the ladder after someone .', 'A little girl is climbing a ladder .', 'A person on a ladder with a baby underneath .', 'A person stands at the top of a ladder as a young girl begins to climb .', 'A person stands on a ladder and a small child climbs at the bottom of the ladder .']"
2472896179_245e7d142f.jpg,a body of water,"['A man about to paraglide from the water .', 'A man glides on top of the water .', 'A man is pulled through the water on a large ski .', 'a man on the sea .', 'man holding harness waterskiing']"
2257099774_37d0d3aa9a.jpg,a woman wearing a red hat,"['An elderly Asian woman wearing a blue winter coat and red hat in front of a food counter .', 'A woman in a red cap in a store .', 'A woman wearing a red hat and black coat .', 'A woman with a red hat and face stands in front of jars .', 'The hapy asian woman is at the market .']"
3041348852_872c027c16.jpg,a group of dogs running in the grass,"['Five small white dogs are wearing muzzles and running .', 'Five white and white and brown , muzzled dogs run across a green , grassy lawn .', 'Five white dogs with muzzles are running towards the camera .', 'Little muzzled white dogs are running in the grass .', 'Several dogs in muzzles are racing on the grass .']"
2853407781_c9fea8eef4.jpg,a man sitting on the sidewalk,"['A man in a brown jacket and beige cap is drinking from a Styrofoam cup .', 'A man in a jacket and cap is crouching down and drinking from a cup .', 'A man in a leather jacket drinking coffee .', 'A man is crouched down next to a building sipping a drink .', 'A man wearing a coat is leaned against wall drinking from a white cup .']"
2543017787_9720b4fa1c.jpg,a little girl on a swing,"['A child in a red shirt and hat enjoys a tire-shaped swing at the playground .', 'A child rides a swing .', 'A girl in a red shirt is on a tire swing .', 'A small child riding on a ring swing .', 'A young child wearing a red shirt swinging on a faux tire swing .']"
515702827_be3c6ce857.jpg,two people in the water,"['A child in a pink hat on a pink surfboard .', 'A girl in pink and man in black paddle through water .', 'A man in a black shirt swims next to a girl on a pink surfboard .', 'A man swimming beside a girl on a pink body board .', 'Two children splash through the water , one is wearing a pink swim cap .']"
3356748019_2251399314.jpg,the sky is clear and blue,"['Cyclists are leaping into the air whilst being watched by spectators .', 'Three dirt bike racers head over a jump .', 'Three men form an arch during a BMX bike race sponsored by Coca-Cola .', 'Three men on mountain bikes go over a sand hill .', 'Three riders wearing black jerseys jump their BMX bikes into the air .']"
3437315443_ba2263f92e.jpg,a little girl wearing a red jacket,"['A child in a red jacket holding up two fingers .', 'A little girl holds onto a pole on a city street .', 'A little girl in a red shirt holds on to a pole near a street .', 'A little girl is standing by a metal pole holding her fingers up in a v sign .', 'A young girl holds up a peace sign .']"
3220200084_3ea129336e.jpg,a woman carrying a baby,"['A black woman with a colourful bandanna on her head carrying a sleeping boy in a backpack .', 'A boy takes a nap as his mother carries him on her back .', 'A lady with her son attached to her back', 'A smiling woman carrying her baby in a sling .', 'A woman carries a sleeping baby on her back .']"
241347580_a1e20321d3.jpg,the girl is wearing a red shirt,"['Two blonde girls wear sports jerseys while watching a game together .', 'Two girls sit near a wall and watch a sporting event .', 'Two girls wearing red jerseys , each with long light brown hair , sit in the stands .', 'Two young , blonde girls in red and white ball uniforms with people behind them .', 'Two young girls appear to be at attention during the national anthem .']"
3432495898_a5859f06b6.jpg,a dog rolling around on the ground,"['A brown dog laying on its back .', 'A brown dog lies upside down on the cement road .', 'A dog lies on his back on a road .', 'A large dog is laying on its back , outside on a blacktop , with its legs in the air .', 'A tan dog is rolling on his back on some asphalt with a bike and a scooter in the background .']"
2693539377_5442430f81.jpg,a group of people riding on a roller coaster,"['a boy and girl riding a roller coaster', 'Children on a ride at an amusement park .', 'The children are smiling whist sitting on a fairground ride .', 'Two children swing around on a carnival ride .', 'two little kids having fun at a roller coaster']"
3696698390_989f1488e7.jpg,a man doing a trick on a motorcycle,"['a bicyclist wearing a helment riding down a steep ramp', 'A bike rider catches air near a ramp .', 'A BMX rider in midair .', 'A man wearing a green shirt is jumping his bicycle off a ramp .', 'Cyclist in green shirt doing trick on wooden ramp']"
3565021218_d2bc1aa644.jpg,a little girl in a yellow dress laying on a bed,"['A little girl in a yellow dress lays on a wooden floor surrounded by flowers .', 'a young girl in a bright yellow dress surrounded by yellow flowers', 'a young girl wearing yellow lays on the ground .', 'The girl with a yellow dress and sandals on is surrounded by yellow flowers .', 'The small girl in the yellow dress laid on the bedspread surrounded by flowers .']"
3581451227_618854cea4.jpg,white clouds in the sky,"['A flower girl and ring bearer watch the flower petals hit the grass .', 'A flower girl drops petals while the ring bearer watches .', 'A little girl and boy after a wedding in a field', 'A young girl in a yellow dress and a small boy in a white suit .', 'There is a young girl in a yellow dress and a young boy in a white suit standing in a field of grass .']"
143552829_72b6ba49d4.jpg,a man riding a dirt bike through a stream,"['A boy in a black helmet and red long sleeve shirt rides his motorbike over a rocky stream .', 'A man on a motorcycle steers through swampy terrain', 'A man rides his bike over rocks and a creek .', 'A motocross bike is being ridden between markers in a running stream .', 'A person is dirt biking over rocks and water .']"
2435685480_a79d42e564.jpg,a woman sitting on a rock,"['A girl wearing a brown cap , red sneakers , and a dark green coat sits on a rock bench .', 'A hiker in a jacket and knit cap sits with a backpack on atop a stone with a cloudy sky in the background .', 'A woman in a knit cap and green coat its on a stone block , looking out .', 'A woman with her backpack sits on a large rock and looks down over the mountains .', 'The lady is sitting on a rock .']"
3656906086_7034f69ab6.jpg,two dogs are playing with each other dogs,"['A black dog is biting the neck of a brown dog', ""A dog bites another dog 's neck ."", 'The black and brown dog with a red collar bites the brown dog .', 'Two dogs play with each other outside .', 'Two dogs wrestle outdoors .']"
1299459562_ed0e064aee.jpg,three boys playing in the water,"['Three boys in baggy bathing suits play in splashing water in front a of grey , block wall .', 'three boys in size order getting wet next to a wall', 'Three boys play in a spray of water .', 'Three boys playing in some water .', 'Three shirtless boys are playing in the water .']"
3630332976_fdba22c50b.jpg,the boy is wearing a red shirt,"['Boy pulls other boy over back .', 'One boy hoists another boy up on his back .', 'One child lifts another on his back , inside a room .', 'The boy in the gray shirt is holding the boy in the red shirt on his back .', 'Two boys are back to back as one holds up the other .']"
2665586311_9a5f4e3fbe.jpg,two girls walking in the street,"['A girl in pink pants running , an ornate Spanish ruin in the background .', 'The girl dressed in purple walks through the alley , followed by a girl in pink .', 'Two children within the ruins of a building .', 'Two girls , one running away from the wall .', 'Two little girls play around an old abandoned building .']"
2893476169_f38dd32051.jpg,a man doing a trick on a skateboard,"['A guy jumps high on his skateboard .', 'A male skateboarder is captured midair .', 'A man in midair on a skateboard .', 'A skateboarder flies thorugh the air while others watch .', 'A youth riding a skateboard is airborne amongst the basketball courts .']"
253762507_9c3356c2f6.jpg,a silver subway train,"['A security man guards the door as another one brings his items off .', 'A subway worker stands next to a car with several garbage bags inside .', 'Someone is pulling a big black bag onto a subway .', 'There is a bum getting out of a subway car .', 'Trash spills out of a subway door .']"
1490213660_9ea45550cf.jpg,a dog in the water,"['A dog is trotting through a shallow stream', 'A light colored dog is walking through a stream .', 'A male weimaraner with a clipped tail is walking through a river .', 'a tan dog walking along in a stream', 'The brown dog is walking through a river surrounded by bushes .']"
2403544744_cba152f5c1.jpg,a dog chasing a cow,"['A dog runs by two cows .', 'A light brown dog is playing in front of two spotted cows .', 'Dog herding cows', 'Dog running in front of two white and brown cows .', 'Two cows stand nearby while a dog races past both of them .']"
492341908_1ef53be265.jpg,two kids on a four wheeler atv,"['Two girls are riding a 4 wheeler .', 'Two girls are sitting on an ATV on the sand in front of a bridge .', 'Two girls riding an ATV .', 'Two kids are posing on a black ATV that is on top of sand .', 'Two young girls drive an ATV .']"
554526471_a31f8b74ef.jpg,a group of people on the beach,"['A group exercise session at the beach .', 'A group of people are doing aerobics in the ocean .', 'A woman is leading an exercise group on the seashore .', 'many people exercising in the ocean', 'The ladies do water aerobics on the beach .']"
3240090389_97a8c5d386.jpg,a skateboarder in a skate park,"['A person in a red shirt on a skateboard .', 'A person riding a skateboard .', 'A teenage male grinds on his skateboard .', 'The skateboarder does a trick on a ramp .', 'While doing tricks , the skateboarder is at the top of the half pipe .']"
410042380_517ccee020.jpg,a woman sitting on a couch,"['A blond woman is sitting in a brown leather chair while another woman is walking next to a store in the background', 'A person sits in a brown chair and is holding bags in their hand .', 'a woman sitting on a large brown couch in the middle of a mall', 'A woman is sitting in a brown chair in the center of a mall .', 'Three people , one sitting , two standing , are in a mall .']"
3485599424_94de8ede51.jpg,a brown and white dog,"['A brown and white dog plays in the yard by a house .', 'A brown and white dog standing in a yard .', 'A dog chained in fronr of a house .', 'A dog stands on the grass while tied up .', ""A leashed dog is in the backyard of someone 's home .""]"
2662890367_382eaf83bd.jpg,a man laying on the ground in a park,"['A man is laying down on grass near trees and a hose .', 'A man is lying the grass with long hair and beard .', 'A person lays in the grass .', 'A person lies in a grassy area near a building .', 'one man lying of the ground in the grass surrounded by trees .']"
