image,blip_caption,reference_captions
2410040397_1a161a1146.jpg,a dog running on a trail in the woods,"['A black and brown dog is running through the woods .', 'A black and brown dog runs through the woods .', 'A dog running through the woods .', 'A dog runs through the woods .', 'Brown dog with mouth open running toward camera in a wooded area .']"
3384528359_e920154177.jpg,a bird in the water,"['A crane , wings outstreached , above the ocean .', 'A large bird landing on water .', 'A large gray and white bird begins to take flight .', 'Bird spreads wings over water .', 'Large dark bird over the water .']"
3116731299_6139b25c18.jpg,the grass is green,"['A little dog carries a small stick in his mouth .', 'A little dog is carrying a small twig in its mouth .', 'A small dog fetching a small stick .', 'A small dog is carrying a stick in his mouth .', 'A small dog is walking on green grass carrying a stick in its mouth .']"
2884092603_786b53a74b.jpg,the girl is wearing a white shirt,"['A girl in a white shirt poses and smiles as someone holds up a peace sign behind her .', 'A girl smiles while a boy makes a V sign behind her head .', 'Girl smiling for camera with boy giving her bunny ears', 'Smiling girl with white shirt with boy standing behind making rabbit ears behind her head .', 'The young girl is given rabbit ears by the young boy behind her .']"
429205889_ff5a006311.jpg,this is a christmas tree,"['A woman admiring colorful christmas ornaments .', 'A woman browses through some ornaments .', 'A woman in a black dress looking', 'A woman looking at a colorful display', 'Woman standing next to wire tree with ornamental balls hanging from it']"
494921598_af73bda568.jpg,a hockey player in action on the ice,"['A child is playing ice hockey', 'a young hockey player playing in the ice rink', 'A youth playing hockey .', 'The hockey player is skating on the ice smacking the puck .', 'Two people are playing ice hockey .']"
3361882891_6e610ffdbb.jpg,a person doing a trick on a bike,"['A bicycle rider takes a daring jump as his friends watch .', 'a biker jumps over a pile of dirt .', 'A man in blue jeans is jumping a bike over hills of dirt .', 'A man jumps off a ramp on his bike .', 'A man rides a bicycle over a dirt ramp .']"
3033257301_e2c8a39b04.jpg,a group of women walking down the street,"['The three ladies stand at attention in their native garb .', 'Three people , dressed in green , orange , and yellow , holding hands with one another .', 'Three thin women in colorful dresses .', 'Three women in brightly colored dresses .', 'three women wearing bright colored dresses hold hands .']"
2192475933_d779bf42eb.jpg,a clear blue sky,"['A boy in a wetsuit on a crowded beach', 'A boy is wearing a wetsuit on a crowded beach .', 'A boy wearing a black wetsuit stands on a crowded beach .', 'a boy wears a wetsuit at the beach .', 'child wearing a hat at the beach']"
2528489543_546c1ca81f.jpg,the water slide is blue,"['A boy splashes into a pool , ejected from a water slide .', 'A boy stands in the pool at the bottom of a blue water slide .', 'A child makes a splash in the pool as he emerges from the water chute .', 'A girl splashes in the water near a big blue water slide .', 'One blue and one green water slide .']"
247619370_a01fb21dd3.jpg,woman sitting on a red bench,"['A woman in a black shirt sitting on a red bench .', 'A woman is sitting and staring on a red bench near a building .', 'A woman wearing sunglasses sits on a red bench in front of a yellow building .', 'The woman in the brown shirt is sitting on a bright red bench .', 'Woman in a black shirt sitting on a red bench .']"
3531811969_49af4c22f0.jpg,a man doing a trick on a bike,"['A bike rider performs a trick .', 'A bmx biker is currently in midair doing a front flip .', 'A man upside down while jumping a bicycle .', 'A person is flipping on a trick bike .', 'The young man is performing a summersault in the air with a bicycle .']"
3226796100_08c49cfa5c.jpg,a little girl playing with a toy in a field,"['A small child practices golf .', 'A small child with a toy golf club', ""a young child wearing a white coat playing a children 's gold game ."", 'A young girl wearing a pink coat plays with a yellow toy golf club .', 'The bundled up child is playing with toys outdoors .']"
3189964753_a95536ced9.jpg,a group of people standing in a parking,"['A crowd gathers behind an older man .', 'A man is posing for the camera in front of a group of people .', 'An old man in a brown shirt stands while a crowd looks on .', 'Man in brown shirt and beard is being watched by a group of people on the street .', 'Man in brown shirt on sunny street , a crowd in background']"
2522809984_2e8a7df4fb.jpg,a dog in the water,"['A black dog is swimming through the water .', 'A black dog swimming .', 'A black dog swimming in water .', 'A black lab swims , with only its head above the water .', 'The drenched dog is swimming .']"
3533484468_0787830d49.jpg,a woman talking on a cell,"['A man is standing next to a woman and he is holding an electronic device to his ear .', 'A man on a cellphone standing with a woman .', 'A young couple in a busy city', 'Couple talking and looking in same direction , man is using a cellphone and wearing a gray sweatshirt woman is wearing a black coat .', 'Guy and girl in jackets while guy listens to mobile device']"
3263497678_8bb688ca01.jpg,two people on skateboards,"['The 2 runners are ready for the track .', 'Two people are in running race starting position with a long lane field ahead of them .', 'Two runners are at the starting blocks , readying for a race .', 'Two runners are at the starting line getting ready to race .', 'Two runners get ready to race on a track .']"
2956413620_d59de03a06.jpg,a car driving down the street,"['A black car on the street behind wire mesh .', 'A drag racer speeds down a city street in a black race car .', 'A man wearing a helmet driving a black race car down the street', 'A person wearing a white helmet races in a black race car .', 'Someone drives a fast car past old buildings .']"
460935487_75b2da7854.jpg,a black and white dog,"['A black and white dog is running up a path towards some potted plants .', 'A dog follows another dog around the corner but looks back .', 'A dog is turns back toward the camera near some potted plants .', 'A dog turning to look at the camera .', 'A white and black dog in a hallway filled with potted plants .']"
3262647146_a53770a21d.jpg,two boys playing in the dirt,"['A little boy jumps in the air while his younger brother looks on .', 'boy jumps through mud puddle .', 'The two young boys play in a puddle on a comfortable day .', 'Two children are playing in a mud puddle .', 'two little boys play with a puddle .']"
2890731828_8a7032503a.jpg,a fire in a building,"['Firemen are battling a fire .', 'Firemen stand outside a burning building with lots of smoke .', 'The firefighters are just under the flames and smoke .', 'There is a group of firemen watching a huge fire in some buildings in the distance .', 'Three firefighters duck from fire and smoke coming from a building .']"
2800934095_b84a5009dd.jpg,the dog is brown and black,"['A dachshund returning a tennis ball .', 'A dog is running through a low-cut field with a ball .', 'A little brown dog has a ball in its mouth .', 'A weiner dog catches a blue and yellow tennis ball .', 'The small brown dog is running through the grass with a yellow ball in its mouth .']"
241347460_81d5d62bf6.jpg,a man running with a football on a field,"['A football player kicks the ball .', 'An Oklahoma football player attempts to kick the ball .', 'A player for the Oklahoma Sooners football team punts the ball during a game .', 'Oklahoma University kicker , kicking the football', 'The football player in red kicks off the ball .']"
2176874361_2b4149010b.jpg,a brown and white cow,"['A black dog runs in front of a large brown and white bull .', 'A dog and a cow play together inside the fence .', 'a small black dog growling at a large brown and white cow .', 'Running dog and cow in fenced area .', 'The dog is running around the cow .']"
3137061312_eb5fdcf3fd.jpg,the train is on the tracks,"['A subway train with lights on is at the station .', 'A train approaches in a dimly lit subway .', 'A train is underground .', 'The train is coming down the track .', 'train in station']"
3106791484_13e18c33d8.jpg,a boy jumping on a bed,"['A blond child is jumping facefirst onto a bed .', 'a little boy jumps onto a bed .', 'Boy in black shirt jumps onto bed from dresser .', 'Boy is bouncing over the bed wearing a black t-shirt .', 'Little blonde boy is falling onto a bed .']"
1814391289_83a1eb71d3.jpg,the door is white,"['A boy dressed as Spiderman ringing a door bell', 'A child dressed as Spiderman ringing a doorbell .', 'A child that is dressed as Spiderman is ringing the doorbell .', 'At Halloween , this little spiderman waits to get some candy .', 'A young child in a costume rings the door bell of a gray house .']"
3546720729_38fff1bbd9.jpg,the man is playing the cello,"['A man with a double bass and a man with a mandolin play music .', 'A seated man playing a small guitar next to a standing man plucking a bass .', 'one man sitting playing a small guitar while another man is standing playing a large chello .', 'The two gentleman are playing stringed instruments .', 'two men play instruments .']"
1396703063_e8c3687afe.jpg,the man is wearing a straw hat,"['A man in a blue shirt , cowboy hat and a cross neckless walking in front of a carnival or amusement park ride .', 'A man in a hat , white shirt and gold chain with a cross .', 'A man wearing a cowboy hat and a gold cross around his neck', 'A man wearing a white shirt , gold cross , and a cowboy hat is standing in front of a roller coaster .', 'A man with a hat is walking']"
374103966_2987706be1.jpg,a man in a white shirt,"['A large man at a party , with a drink in his right hand .', 'A large man in white dances in the middle of a crowd holding a beverage in his hand .', 'A robust man with his mouth open in a white shirt and glasses holding a drink near other people .', 'Bearded overweight man carrying drink and yawning .', 'Overweight man with beard in white shirt holding a drink at a bar , dancing .']"
2066048248_f53f5ef5e2.jpg,snow on the ground,"['A group of horses and people in front of a snowy mountain .', 'The riders and horses are taking a break and resting on the mountain trail .', 'Three men are standing around pack horses in front of a red tent up in the mountains .', 'three riders stand around their horses in the mountains .', 'Two men and some horses on a snowy mountain .']"
2221818690_9003756d33.jpg,a man with white paint on his face,"['A clown blowing a whistle .', 'A man with his face painted white is blowing a whistle .', 'A person in white makeup and clothes blowing a whistle .', 'A teenager blows a whistle and wears white face paint , ear muffs , and a yellow hat while another teen watches .', 'Man with a painted white face blowing a whistle .']"
333973142_abcd151002.jpg,a dog running in the woods,"['A black dog carries a tree branch through the woods .', 'A black dog holding a small branch .', 'A brown and black dog carries a precariously long stick in his mouth in the wooded area .', 'A dog carries a large stick .', 'A rottweiler carries a very long stick in his mouth through the woods .']"
2248487956_2603f55ab9.jpg,a woman talking on a cell phone,"['An elderly woman in burgundy scratches her face as she observes a young man in a blue jacket and white baseball cap .', 'An elderly woman is looking at a teenage boy', 'A woman scratching her face .', 'There are two people , a lady with a big ring on her finger , and a boy wearing a blue jacket .', 'The woman in red clothing is wearing a ring and looking at a boy in blue clothing .']"
360723732_23199af4bf.jpg,a dog with a red ball in its mouth,"['A black and white dog has a red toy in his mouth and is jumping .', 'A dog is standing on its hind legs with its paws outstretched whilst carrying a red object in its mouth .', 'A dog with a red object in its mouth is hurrying down a smooth path near grass and another dog .', 'A dog with a red toy in its mouth .', 'dog with something red in mouth']"
3427118504_93126c83e0.jpg,man wearing a brown shirt,"['A grown man and a topless girl are dancing .', 'A shirtless child dances with an adult man .', 'A shirtless child plays with an adult indoors .', 'Man and child dancing .', 'The man in the brown shirt is holding the hand of the long haired child in front of a painting .']"
2939371251_f923569a72.jpg,white lines on the field,"['A football player runs with the ball , chased by members of the opposing team', 'A running back running with the football .', 'Many football players are running on the grassy field .', 'Men playing football .', 'Two teams compete in football .']"
3284899112_f11ab3cfe6.jpg,two people sitting on a bench in front of a building,"['A man and a woman are standing in front of a building', 'A man and woman stand in front of a white building and look at their hands .', 'A older couple next to the box office .', 'Eldery couple wearing hats looking at tickets on the street .', 'Old man and woman in jackets facing each other']"
1472882567_33dc14c8b6.jpg,shadows on the snow,"['a group of skiers going up a mountain', 'Four cross-country skiers climb uphill .', 'Four people climbing a hill in the snow .', 'Four skiers walking up a snow covered hill .', 'four skiers climbing snow drapped mountain .']"
2862931640_2501bd36c5.jpg,a group of people,"['A group of young people pose for a group photo while a man does a bike jump .', 'A person jumping off a ramp on a bike over a crowd .', 'A topless guy jumping a ramp on a bike .', 'People cheer as a bicyclist rides his bike off a ramp', 'People cheer as a man rides a bmx bike in midair']"
2856699493_65edef80a1.jpg,a man pushing a woman on a bike,"['A man talks to a woman wearing a backpack .', 'A woman with a bag talks to a man on a bicycle near a street .', 'Man riding a bicycle as woman walks beside him on a street .', 'The woman carrying a backpack is facing the camera , while the man is turned away .', 'The woman in the white shirt and black backpack is walking with the man in the blue shirt .']"
3283897411_af9d0b497d.jpg,a girl holding a fire,"['A child in pink holds an object that appears to be on fire .', 'A child playing with fire .', 'A little girl in a pink top is spinning a stick that has been set on fire .', 'Child holding an object that is on fire .', 'Little girl holds flaming object at sunset .']"
3050650135_23f9d9d2f8.jpg,two men playing soccer,"['A man in a blue jersey is kicking a ball while another man watches .', 'A man in a number ten jersey kicks a soccer ball while another team member watches .', 'A rugby player swings his leg back to punt the ball .', 'Number ten is kicking the ball as number seven watches .', 'Two men in blue jersey tops and white shorts play soccer ,']"
3174196837_800689a2f3.jpg,a group of dogs running in the snow,"['A group of dogs run through the snowy field .', 'Four dogs happily running in snow .', 'Four dogs running in the snow', 'Four dogs running over snow covered grass .', 'Several different colored dogs running in a snowy field']"
2490179961_e842fda5eb.jpg,two young girls with their mouths open,"['Two children with chocolate around their mouths are pulling funny faces .', 'Two girls are making funny faces and one has food smeared on her face around her mouth .', 'Two girls with chocolate mouths', 'Two little brown haired girls are grinning and squinting their eyes .', 'Two little girls , one with chocolate on her face , make faces .']"
84713990_d3f3cef78b.jpg,a group of people in a raft,"['A group of people on a blue raft going down a river .', 'A group of people paddle their blue inflatable raft down the rapids .', 'a group of people white water rafting in a blue raft .', 'Several people are rafting down a choppy river in rocky terrain .', 'Some people are riding a raft down a white water river .']"
3215695965_69fbeba3d5.jpg,this is a shopping cart,"['A boy inside a shopping cart .', 'A boy sits inside a shopping cart .', 'A child plays inside a shopping cart that has been stacked with others to create a cage .', 'a young boy tapped in a shopping cart .', 'A young boy trapped in a shopping cart .']"
3739833689_a0038545bd.jpg,a boy holding a baseball bat,"['A little boy puts a bat on his forehead and spins around .', 'A young boy holds his head to a baseball bat on the green grass .', 'A young boy is spinning around a baseball bat on the grass .', 'Little boy puts his forehead on the baseball bat and spins around to make himself dizzy .', 'The little boy is wearing red shorts and a white t-shirt and has his head resting on a baseball bat .']"
549887636_0ea5ae4739.jpg,a man standing in the middle of a street,"['A man dressing in a black shirt is waiting to cross the street with traffic .', 'A man standing in a crosswalk', 'A man waiting for traffic to stop at road crossing', 'An asian man tries to jaywalk on a street with heavy traffic .', 'Man waits for taxis to pass before crossing the wet road .']"
1100214449_d10861e633.jpg,water fountain in front of building,"['A boy in s striped shirt is jumping in front of a water fountain .', 'A boy is jumping off the side of a running stone water fountain in front of a building .', 'A happy boy is jumping in front OD city fountain .', 'A little boy is jumping in front of a fountain .', 'A little boy is playfully jumping off the side of a fountain .']"
3426966595_c8c4e1e872.jpg,a large wooden door,"['A gorup of boys are playing with a ball in front of a large wooden door .', 'Children kicking ball in front of very large medieval looking building', 'Children play in front of a large door .', 'Four boys playing a game with a soccer ball in front of a large set of ornate doors .', 'Kids playing ball outside in front of building .']"
3490528249_6aae9b867b.jpg,two cars racing on a track during a race,"['Two automobiles race each other and pour smoke from behind .', 'Two drag racing cars resembling train locomotives are leaving the starting line .', 'Two dragsters race down the track in front of a crowd of spectators watching the drag race from the stands .', 'Two race cars speed along a track with smoke coming from the backs of them .', 'Two rocket dragsters racing at a dragsters .']"
2081615901_13092cac56.jpg,two little girls standing on a chain link fence,"['The backs of two girls dressed identically in black shirts and black and red plants as they climb on a fence .', 'Two children in identical outfits hang on a chain link fence .', 'Two girls wearing red pants , black pants , and sandals are climbing a chain link fence .', 'Two identically dressed girls climbing a fence', 'Two young girls in matching outfits standing on a chain link fence .']"
3429142249_d09a32e291.jpg,a man climbing up a snowy mountain,"['A climber hanging from an ice pick in the side of a frozen waterfall .', 'A climber with a blue hat is scaling an icy rock cliff .', 'A man repels down a snowy mountain .', 'A rock climber scales an icy wall .', 'The climber is wearing a red jacket as he climbs the ice .']"
429270993_294ba8e64c.jpg,a group of people walking down the street,"['A man in camouflage pants and a backwards cap carrying a toolbox and a backpack .', 'A man wearing urban combat pants is walking down the street carrying a toolbox .', 'Man carrying a tool box on a sidewalk', 'Man is carrying a tool box down the sidewalk .', 'Young man in camo pants carries a large metal box walks along the sidewalk .']"
318667317_108c402140.jpg,a man wearing a black jacket,"['A bearded man holding a sign .', 'A homeless man carries a sign that says "" hungry "" .', 'a homeless person asking for help', 'A man in a black hoodie holding a small sign .', 'A man in a black hoodie is holding a paper sign .']"
3539767254_c598b8e6c7.jpg,the water is green,"['A gondola is steered through the canals with other boats around .', 'A man is steering a gondola with people in it down a river with buildings all around .', 'a man rowing a ganilla down a watery path', 'Man in a gondola in a canal .', 'The gondola is poling his boat in the canal .']"
2534194182_ac53035cf4.jpg,a group of dancers,"['a group of band members doing a routine', 'A group of girls , in white skirts and green tops , walk in a circle carrying rifles in front of a drum line .', 'A marching band performing .', 'A marching band performs in an auditorium', 'Some marching band members in green and white outfits .']"
3565654691_22b97d3994.jpg,a clear blue sky,"['A man admires a rock formation on the water .', 'a man climbing a huge rock wall overlooking the blue ocean', 'a man kicks a large rock near the ocean .', 'A man stands by a boulder near an ocean .', 'A scuba diver stands on top of rocks after emerging from the water .']"
3358558292_6ab14193ed.jpg,a group of people standing in a room,"['A group of 5 people making different expressions .', 'five teenagers cheering in a living room', 'The room full of youths reacts emotionally as they spectate .', 'Three boy teenagers and two female teenagers are making excited facial expressions .', 'Three guys and two girls are watching something and getting excited .']"
2734219983_fe86a60bf9.jpg,a woman and child walking in the rain,"['A woman and child with an umbrella walk through the street in the pouring rain .', 'a woman in a colorful sari walks with a small boy who is carrying an umbrella through a busy city in the pouring rain .', 'A woman in a sari next to a boy holding a red umbrella in a rainy street', 'A woman walking in the rain with a child .', 'The lady and child walk to school in the rain .']"
2073105823_6dacade004.jpg,a man on a skateboard,"['A man in a black hoodie and jeans skateboards down a railing .', 'A man skateboards down a steep railing next to some steps .', 'a person is sliding down a brick rail on a snowboard .', 'A person walks down the brick railing near a set of steps .', 'A snowboarder rides down a handrail without snow .']"
260520547_944f9f4c91.jpg,a group of people walking on a sidewalk by the water,"['A couple walking alongside a waterfront next to a city .', 'A group of people are walking down a sidewalk beside the beach .', 'People walking down a sidewalk on a beach .', 'People walking down trail beside water', 'The man in shorts and the woman with a dress are walking on the beachfront path .']"
2976684095_ce7ccfd423.jpg,a person doing a handstant in the grass,"['A boy turning a somersault in his yard .', 'A child does cartwheels in the yard .', 'A child performing a cartwheel in a yard .', 'A kid does a tumbling move over a leaf-covered lawn near sundown .', 'A little boy is attempting to do a cartwheel .']"
2244171992_a4beb04d8e.jpg,a group of people walking down the street,"['a group of school children walking around outside in their uniforms', 'Japanese school children are going to class', 'Japanese school girls walk down the street .', 'People walk along on the street .', 'Uniformed schoolgirls are walking together on the street .']"
3019923691_3b3c5a4766.jpg,the dog is wet,"['A black dog wearing an orange collar is entangled with fishing wire .', 'A brown dog in an orange collar shaking off water .', 'A brown dog is shaking off after getting wet .', 'A wet dog shaking off the water with an orange collar .', 'The black dog wearing a red collar shakes water off .']"
103195344_5d2dc613a3.jpg,this is a sculpture,"['A man in black is sitting next to a modern art structure in front of a glass building .', 'A man sits and reads a newspaper by a sculpture outside of an office building .', 'a man sits near a large statue .', 'A man sitting in front of a metal sculpture in front of a building .', 'The man with the backpack is sitting in a buildings courtyard in front of an art sculpture reading .']"
661546153_9d30db6984.jpg,a baby in a high chair,"[""A baby is in an activity chair in a child 's playroom ."", 'A baby is in an bouncy seat with toys surrounding him .', 'A baby playing in a toy', 'a smiling baby is sitting in a white baby bouncer surrounded by toys .', 'Smilling and laughing baby in a walker with fire engine airplane mobile and other toys on the floor']"
3493255026_5fdaa52cbe.jpg,the dog is white and brown,"['A dog playing with a toy .', 'A white and brown dog is playing tug-o-war .', 'A white and brown dog playing with a black toy .', 'a white dog is tugging on a black rope', 'A white dog with brown spots is chewing on a ropey black toy .']"
408233586_f2c1be3ce1.jpg,a dog in the water,"['A brown and black dog fetching a tennis ball in a lake .', 'A dog in water with its head cocked to the side looking at a ball .', 'A dog is running through the water chasing after a ball .', 'A dog is shaking off water in a lake as a red and green tennis ball floats by .', 'A dog playing with a ball in water']"
3487820317_3728e7569e.jpg,blue sky with white clouds,"['A man drinking juice on a sunny day .', 'A man drinking orange juice while walking .', 'A man drinking orange juice while walking on a sunny day .', 'A man drinks orange juice and walks outside .', 'A man in a suit is taking a sip of something while walking outdoors .']"
2525270674_4ab536e7ec.jpg,the dog is brown and white,"['A brown and white dog with a Frisbee in his mouth .', 'A dog with his front paws off the ground holds a white Frisbee in his mouth in an RV campground .', 'A white and brown dog jumps up for a white Frisbee .', 'Dog catching Frisbee .', 'The brown and white dog is catching a Frisbee in his mouth .']"
